{
  "$schema": "https://json-schema.org/draft/2020-12/schema",
  "$id": "https://ospp-standard.org/schemas/v1/ble/challenge.schema.json",
  "title": "Challenge",
  "description": "Challenge message sent by the station to the app via BLE characteristic FFF4 (Notify). Part of the authentication handshake, provides the station nonce and connectivity status.",
  "type": "object",
  "required": [
    "type",
    "stationNonce",
    "stationConnectivity",
    "stationCert",
    "stationEphemeralPubKey"
  ],
  "additionalProperties": false,
  "properties": {
    "type": {
      "type": "string",
      "const": "Challenge",
      "description": "Message type discriminator"
    },
    "stationNonce": {
      "type": "string",
      "pattern": "^[A-Za-z0-9+/]{43}=$",
      "description": "Base64-encoded 32-byte cryptographically random nonce (exactly 44 Base64 characters; N16 — was minLength:1)."
    },
    "stationCert": {
      "$ref": "station-identity.schema.json",
      "description": "Server-signed StationIdentity certificate (06-security.md §6.5.2). The app MUST verify its ECDSA signature and expiry BEFORE sending any OfflinePass. Its stationPubKey is the station's static BLE ECDH key used in es = ECDH(appEphemeral, stationStaticPub)."
    },
    "stationEphemeralPubKey": {
      "$ref": "../common/ec-public-key.schema.json",
      "description": "The station's per-handshake ephemeral P-256 public key (compressed SEC1, Base64). Provides forward secrecy via ee = ECDH(appEphemeral, stationEphemeral). Freshly generated per handshake."
    },
    "stationConnectivity": {
      "type": "string",
      "enum": ["Online", "Offline"],
      "description": "Current network connectivity status of the station"
    },
    "availableServices": {
      "type": "array",
      "description": "Optional snapshot of service availability included with the challenge",
      "items": {
        "type": "object",
        "required": [
          "bayId",
          "serviceId",
          "available"
        ],
        "additionalProperties": false,
        "properties": {
          "bayId": {
            "$ref": "../common/bay-id.schema.json"
          },
          "serviceId": {
            "$ref": "../common/service-id.schema.json"
          },
          "available": {
            "type": "boolean",
            "description": "Whether this service is currently available"
          }
        }
      }
    }
  }
}
